Quelle époque n'appartient pas à l'Histoire ?,Le Moyen-Âge,Le Jurassique,L'Antiquité,L'époque contemporaine,B
À quelle époque a-t-on maîtrisé le feu ?,L'Antiquité,Le Moyen-Âge,La Préhistoire,L'époque contemporaine,C
Quelle invention permet à l'homme de passer de la Préhistoire à l'Histoire ?,L'invention de la roue,L'invention du feu,L'invention de l'écriture,L'invention de la voiture,C
Combien vaut un siècle ?,Un an,Dix ans,Cent ans,Mille ans,C
Les Historiens découpent l'Histoire en grandes périodes historiques. Combien sont-elles ?,2,7,3,5,D
Replacez les cinq périodes historiques dans l'ordre,Moyen-Age => Antiquité => époque contemporaine => temps modernes => préhistoire,Préhistoire => Antiquité => Moyen-Age => temps modernes => époque contemporaine,Antiquité => Moyen-Age => époque contemporaine => préhistoire => temps modernes,X,B
Quel événemnt marque la fin de l'Antiquité ?,La fin de l'Empire romain d'Occident,La mort de César,Les débuts du christianisme,X,A
Quelle période historique s'étale de 476 à 1492 ?,L'époque moderne,L'époque contemporaine,Le Moyen-Âge,L'antiquité,C