Pourquoi le fils de Louis XIII ne peut-il pas régner à la mort de son père ?,Car il est trop jeune,Car il n'en n'a pas envie,Car ses parents ne le veulent pas,X,A
D'où vient le pouvoir de Louis XIV ?,Du pape,De son fils,De Dieu,X,C
Qui règne jusqu'aux 13 ans de Louis XIV ?,Sa mère,Sa mère et le cardinal Mazarin,Le cardinal Mazarin,X,B
En quelle année Louis XIV supprima-t-il l'Edit de Nantes ?,En 1685,En 1762,En 1846,X,A
Quelle part de la population représentent les paysans dans l'Ancien Régime ?,60%,20%,80%,X,C
Dans le portrait de Louis XIV par Rigaud le roi se tient...,Allongé,Debout,Assis,X,B
A la mort de Mazarin qui règne ?,Son cousin,Son frère,Louis XIV,X,C
Comment appelle-t-on le roi Louis XIV ?,Le Roi Soleil,Le roi,Le roi du temps,X,A
Durant la Régence sous Louis XIV la noblesse se révolte. C'est :,La Fronde,La Liberté,La Force,X,A